ISBN,Sales,Stores,Title,Authors,Publisher,Categories,Description,Binding,Subjects
9781541602908,18,2,We Refuse: A Forceful History of Black Resistance,Kellie Carter Jackson,Seal Press,Non-Fiction,"An “unsparing, erudite, and incisive” (Jelani Cobb) reframing of the past and present of Black resistance—both nonviolent and violent—to white supremacy<br/><br/>Black resistance to white supremacy is often reduced to a simple binary, between Dr. Martin Luther King Jr.’s nonviolence and Malcolm X’s “by any means necessary.” In We Refuse, historian Kellie Carter Jackson urges us to move past this false choice, offering an unflinching examination of the breadth of Black responses to white oppression, particularly those pioneered by Black women.<br/><br/>The dismissal of “Black violence” as an illegitimate form of resistance is itself a manifestation of white supremacy, a distraction from the insidious, unrelenting violence of structural racism. Force—from work stoppages and property destruction to armed revolt—has played a pivotal part in securing freedom and justice for Black people since the days of the American and Haitian Revolutions. But violence is only one tool among many. Carter Jackson examines other, no less vital tactics that have shaped the Black struggle, from the restorative power of finding joy in the face of suffering to the quiet strength of simply walking away.<br/><br/>Clear-eyed, impassioned, and ultimately hopeful, We Refuse offers a fundamental corrective to the historical record, a love letter to Black resilience, and a path toward liberation.",Hardcover,"History, Americas, United States, Historical Study & Educational Resources, World, Women in History, Politics & Social Sciences, Social Sciences, Violence in Society"
9781849355544,7,2,"Loving Corrections (Emergent Strategy Series, 12)",adrienne maree brown,AK Press,Non-Fiction,"New York Times-bestselling author adrienne maree brown knows we need each other more than ever, and offers “loving corrections”: a roadmap towards collective power, righting wrongs, and true belonging<br/>This selection of prescient, compassionate essays explores patterns we engage in that are rooted in limited thinking. Through a lens of “loving correction” rather than mere critique, author adrienne maree brown helps us reimagine how to hold ourselves, our loved ones, and our communities accountable by setting clear boundaries, engaging in reflection, and nurturing honest relationships.<br/>Loving Corrections is divided into two sections, with the first portion featuring new essays including “A Word for White People” and “Relinquishing the Patriarchy” and writing on topics like moving from fragility to fortitude, disability, and navigating critique within activist communities. The second section expands and updates pieces from brown's popular monthly column “Murmurations” in YES! Magazine that explore accountability—within oneself and community—with depth, inventiveness, and empathy.<br/>Along with allowing us more authentic access to ourselves and to each other, the “corrections” in the book’s title are intended to explore and break identity-based patterns including white supremacy, fragility, patriarchy, and ableism. brown also offers practical guidance on how to apologize and be accountable from our nuanced positions of power, history, and resources.<br/><br/>Building on her previous work—especially Holding Change and We Will Not Cancel Us—brown reminds us how much we need each other: ""It is only through relationship that we learn how to be, understand our impact on others and explore small shifts that may yield remarkable collective change.""",Paperback,"Literature & Fiction, Essays & Correspondence, Essays, Politics & Social Sciences, Social Sciences, Ethnic Studies, Women's Studies, Feminist Theory"
9780593233825,12,3,"Juke Joints, Jazz Clubs, and Juice: A Cocktail Recipe Book: Cocktails from Two Centuries of African American Cookbooks",Toni Tipton-Martin,Clarkson Potter,Non-Fiction,"JAMES BEARD AWARD NOMINEE • Discover the fascinating history of Black mixology and its enduring influence on American cocktail culture through 70 rediscovered, modernized, or celebrated recipes, by the James Beard Award–winning author of Jubilee.<br/><br/>A BEST COOKBOOK OF THE YEAR: The Boston Globe, Los Angeles Times, Food Network, Good Housekeeping, Garden & Gun, Epicurious, Vice, Library Journal<br/><br/>Juke Joints, Jazz Clubs, and Juice spotlights the creativity, hospitality, and excellence of Black drinking culture, with classic and modern recipes inspired by formulas found in two centuries’ worth of Black cookbooks. From traditional tipples, such as the Absinthe Frappe or the Clover Leaf Cocktail, to new favorites, like the Jerk-Spiced Bloody Mary and the Gin and Juice 3.0, Toni Tipton-Martin shares a variety of recipes that shine a light on her influences, including underheralded early-twentieth-century icons, like Tom Bullock, Julian Anderson, and Atholene Peyton, and modern superstars, such as Snoop Dogg and T-Pain.<br/><br/>Drawing on her expertise, research in historic cookbooks, and personal collection of texts and letters, Toni Tipton-Martin shows how these drinks have evolved over time and shares the stories of how Black mixology came to be—a culmination of generations of practice, skill, intelligence, and taste.",Hardcover,"Cooking, history, Liquors"
9780593197141,4,4,"Black Girl, Call Home",Jasmine Mans,Berkley,Non-Fiction,"A Most Anticipated Book of 2021 by Oprah Magazine • Time • Vogue • Vulture • Essence • Elle • Cosmopolitan • Real Simple • Marie Claire • Refinery 29 • Shondaland • Pop Sugar • Bustle • Reader's Digest<br/><br/>“Nothing short of sublime, and the territory [Mans'] explores...couldn’t be more necessary.”—Vogue<br/><br/>From spoken word poet Jasmine Mans comes an unforgettable poetry collection about race, feminism, and queer identity.<br/><br/>With echoes of Gwendolyn Brooks and Sonia Sanchez, Mans writes to call herself—and us—home. Each poem explores what it means to be a daughter of Newark, and America—and the painful, joyous path to adulthood as a young, queer Black woman.<br/><br/>Black Girl, Call Home is a love letter to the wandering Black girl and a vital companion to any woman on a journey to find truth, belonging, and healing.",Paperback,"LGBTQ+ Books, Literature & Fiction, Poetry, Regional & Cultural, Women Authors"
9780063137929,4,3,"Black Girls Must Be Magic: A Novel (Black Girls Must Die Exhausted, 2)",Jayne Allen,Harper Perennial,Fiction,"“Masterfully written and pitch perfect, Black Girls Must Be Magic is, simply, magic.”—Good Morning America<br/>In this highly anticipated second installment in the Black Girls Must Die Exhausted series, Tabitha Walker copes with more of life’s challenges and a happy surprise—a baby—with a little help and lots of love from friends old and new.<br/>For Tabitha Walker, her grandmother’s old adage, “Black girls must die exhausted” is becoming all too true. Discovering she’s pregnant—after she was told she may not be able to have biological children—Tabitha throws herself headfirst into the world of “single mothers by choice.” Between her job, doctor’s appointments, and preparing for the baby, she’s worn out. And that’s before her boss at the local news station starts getting complaints from viewers about Tabitha’s natural hair.<br/>When an unexpected turn of events draws Marc—her on and off-again ex-boyfriend—back into her world with surprising demands, and the situation at work begins to threaten her livelihood and her identity, Tabitha must make some tough decisions about her and her baby’s future. It takes a village to raise a child, and Tabitha turns to the women who have always been there for her.<br/>Bolstered by the fierce support of Ms. Gretchen, her grandmother’s best friend, the counsel of her closest friends Laila and Alexis, and the calming presence of her doula Andouele, Tabitha must find a way to navigate motherhood on her own terms. Will she harness the bravery, strength, and self-love she’ll need to keep “the village” together, find her voice at work, and settle things with Marc before the baby arrives?",Paperback,"Literature & Fiction, Genre Fiction, Historical, Family Life, Friendship, Women's Fiction, Domestic Life, United States, Black & African American"
9781481450164,6,2,Ghost (1) (Track),Jason Reynolds,Atheneum/Caitlyn Dlouhy Books,Non-Fiction,"A National Book Award Finalist for Young People’s Literature<br/>Nominated as one of America’s best-loved novels by PBS’s The Great American Read<br/><br/>Ghost wants to be the fastest sprinter on his elite middle school track team, but his past is slowing him down in this first electrifying novel of the acclaimed Trackseries from Coretta Scott King - John Steptoe Award–winning author Jason Reynolds.<br/><br/>Ghost. Lu. Patina. Sunny. Four kids from wildly different backgrounds with personalities that are explosive when they clash. But they are also four kids chosen for an elite middle school track team—a team that could qualify them for the Junior Olympics if they can get their acts together. They all have a lot to lose, but they also have a lot to prove, not only to each other, but to themselves.<br/><br/>Running. That’s all Ghost (real name Castle Cranshaw) has ever known. But Ghost has been running for the wrong reasons—it all started with running away from his father, who, when Ghost was a very little boy, chased him and his mother through their apartment, then down the street, with a loaded gun, aiming to kill. Since then, Ghost has been the one causing problems—and running away from them—until he meets Coach, an ex-Olympic Medalist who sees something in Ghost: crazy natural talent. If Ghost can stay on track, literally and figuratively, he could be the best sprinter in the city. Can Ghost harness his raw talent for speed, or will his past finally catch up to him?",Paperback,"Sprinting, Middle schools, Self-realization, Juvenile fiction, JUVENILE FICTION / Social Issues / Friendship, Fathers and sons, JUVENILE FICTION / Social Issues / Adolescence, Emotional problems, Running, JUVENILE FICTION / Sports & Recreation / General, Schools, Runners (Sports), Track and field, Fiction, Coaches (Athletics)"
9780316475099,19,2,"Dream Big, Little One (Vashti Harrison)",Vashti Harrison,LB Kids,Children's,"This beautifully illustrated board book edition of Little Leaders: Bold Women in Black History by #1 New York Times bestselling author Vashti Harrison showcases women who changed the world, and is the perfect goodnight book to inspire big dreams.<br/><br/>Dream Big, Little One features eighteen trailblazing Black women in American history, including heroes, role models, and everyday women who did extraordinary things—bold women whose actions and beliefs contributed to making the world better for generations to come. Whether they were putting pen to paper, soaring through the air, or speaking up for the rights of others, the women profiled in these pages took a stand against a world that didn't always accept them.<br/><br/>The leaders in this book may be little, but they all did something big and amazing.",Board book,"Children's Books, History, United States, Growing Up & Facts of Life, Friendship, Social Skills & School Life, Biographies, Historical, Multicultural, Women, Geography & Cultures, Multicultural Stories"
9780063380608,10,2,Lore of the Wilds: A Novel,Analeigh Sbrana,Harper Voyager,Fiction,"A Library With A Deadly Enchantment. A Fae Lord Who Wants In. A Human Woman Willing To Risk It All For A Taste Of Power. In A Land Ruled By Ruthless Fae, Twenty-one-year-old Lore Alemeyu's Village Is Trapped In A Forested Prison. Lore Knows That Any Escape Attempt Is Futile-her Scars Are A Testament To Her Past Failures. But When Her Village Is Threatened, Lore Makes A Desperate Deal With A Fae Lord. She Will Leave Her Home To Catalog/organize An Enchanted Library That Hasn't Been Touched In A Thousand Years. No Fae May Enter The Library, But There Is A Chance A Human Might Be Able To Breach The Cursed Doors. She Convinces Him That She Will Risk Her Life For Wealth, But Really She's After The One Thing The Fae Covet Above All: Magic Of Her Own. As Lore Navigates The Hostile World Outside, She's Forced To Rely On Two Fae Males To Survive. Two Very Different, Very Dangerous, Very Attractive Fae Males. When Undeniable Chemistry Ignites, She's Not Just In Danger Of Losing Her Life, But Her Heart To The Very Creatures She Can Never Trust-- Provided By Publisher.",paperback,"Romance, Paranormal, Fantasy, Literature & Fiction, Mythology & Folk Tales, Folklore, Science Fiction & Fantasy, Romantic, Genre Fiction, Historical, United States, Black & African American"
9780399257742,4,3,Last Stop on Market Street,Matt de la Peña,G.P. Putnam's Sons Books for Young Readers,Children's,"#1 New York Times Bestseller<br/>A USA Today Bestseller<br/>Winner of the Newbery Medal<br/>A Caldecott Honor Book<br/>A Coretta Scott King Illustrator Honor Book<br/><br/>This award-winning modern classic—a must-have for every child’s home library—is an inclusive ode to kindness, empathy, gratitude, and finding joy in unexpected places, and celebrates the special bond between a curious young boy and his loving grandmother.<br/><br/>Every Sunday after church, CJ and his grandma ride the bus across town. But today, CJ wonders why they don’t own a car like his friend Colby. Why doesn’t he have an iPod like the boys on the bus? How come they always have to get off in the dirty part of town? Each question is met with an encouraging answer from grandma, who helps him see the beauty—and fun—in their routine and the world around them.<br/><br/>This energetic ride through a bustling city highlights the wonderful perspective only grandparent and grandchild can share, and comes to life through Matt de la Peña’s vibrant text and Christian Robinson’s radiant illustrations.",Hardcover,"Children's Books, Growing Up & Facts of Life, Family Life, Difficult Discussions, Cars, Trains & Things That Go, Geography & Cultures, Multicultural Stories, Where We Live, Reference, Self Service, Custom Stores"
9780897334556,6,3,The Afrofuturist Evolution: Creative Paths to Self-Discovery,Ytasha L. Womack,Lawrence Hill Books,Non-Fiction,Unknown,Paperback,"Politics & Social Sciences, Social Sciences, Communication & Media Studies, Popular Culture, Ethnic Studies"
9780063342262,18,2,"Hello There, Sunshine",Tabitha Brown,HarperCollins,Children's,"From America’s Mom—actress, New York Times bestselling author, NAACP Award–winning personality, and Emmy-winning host Tabitha Brown—comes an upbeat, inspiring story about finding your own light.<br/>""Hello there, sunshine!""<br/>Every morning, young Tabitha wakes up and greets the sun. She loves how it brings everyone JOY. But one day she wakes up and the sun is missing! So Tab hops on her strawberry shortcake bike with her puppy in tow and makes it her business to find the sun.<br/>Can she do it? Or will Tabitha find out that sometimes the shine we're looking for is inside of us?<br/>A perfect pick for fans of What Do You Do with an Idea?, You Matter, and Just Because, Brown’s children's debut is a marvelous read-aloud and a great gift that will remind the youngest reader to always stay positive.",Hardcover,"Children's Books, Growing Up & Facts of Life, Friendship, Social Skills & School Life, Literature & Fiction, Poetry, Geography & Cultures, Multicultural Stories"
9780593817100,8,5,The Love Lyric (The Greene Sisters),Kristina Forest,Berkley,Fiction,"An R&B singer and a corporate executive find love that hits the right notes in this romance by Kristina Forest, USA Today bestselling author of The Partner Plot.<br/><br/>Iris Greene used to be a woman with a plan. But all of that changed after she met the love of her life at twenty-five, got pregnant and married…and then became a widow and a single mother all in alittle over two years. Now, after years of hustling, Iris is the director of partnerships at a beauty company and raising sweet six-year-old Calla by herself. Despite her busy life, she still can’t help but feel lonely. She just needs to catch her breath—and one night, at her sister’s wedding, when she steps outside to do just that, she sees a certain singer who takes her breath away. . . .<br/><br/>By all accounts, pop R&B singer Angel Hughes has it made. He’s a successful musician and has just scored a brand ambassador deal with an emerging beauty company. But he’s still not fulfilled; he’s not producing songs he’s passionate about, and there’s a gaping hole in his love life. When he visits the Save Face Beauty office to kickstart his campaign, he’s delighted to see Iris, his stylist’s sister—the beautiful woman he’s secretly had a crush on for years.<br/><br/>Despite their obvious attraction to each other, they must stay professional throughout the campaign tour—a goal that doesn’t quite pan out. But when it becomes clear their lives aren’t in sync, can they fall back in step to the same rhythm and beat?",Paperback,"Literature & Fiction, Dramas & Plays, Comedy, Genre Fiction, Feel-Good, United States, Black & African American, Romance, Contemporary, Romantic Comedy"
9780345350688,22,3,The Autobiography Of Malcolm X,Malcolm X,"Ballantine, 1990",Non-Fiction,"ONE OF TIME’S TEN MOST IMPORTANT NONFICTION BOOKS OF THE TWENTIETH CENTURY<br/><br/>In the searing pages of this classic autobiography, originally published in 1964, Malcolm X, the Muslim leader, firebrand, and anti-integrationist, tells the extraordinary story of his life and the growth of the Black Muslim movement. His fascinating perspective on the lies and limitations of the American Dream, and the inherent racism in a society that denies its nonwhite citizens the opportunity to dream, gives extraordinary insight into the most urgent issues of our own time. The Autobiography of Malcolm X stands as the definitive statement of a movement and a man whose work was never completed but whose message is timeless. It is essential reading for anyone who wants to understand America.<br/><br/>Praise for The Autobiography of Malcolm X<br/><br/>“Extraordinary . . . a brilliant, painful, important book.”—The New York Times<br/><br/>“This book will have a permanent place in the literature of the Afro-American struggle.”—I. F. Stone",Paperback,"Black studies, Biography & Autobiography, Biography / Autobiography, Biography/Autobiography, USA, Cultural Heritage, People of Color, Political, Political Freedom & Security - Civil Rights, Biography & Autobiography / People of Color, Ethnic Studies - African American Studies - General, Islam - General, Afro-Americans, Biography, Black Muslims"
9780593711484,11,2,Easter Fun: A Brown Baby Parade Book,Nikki Shannon Smith,Crown Books for Young Readers,Children's,"It’s time for some Easter fun! Read along as a young girl spends Easter Sunday with her family in this next installment of the Brown Baby Parade board book series that's perfect for ages 0-3.<br/><br/>I quickly spy a pink egg.<br/>But guess what? There are more!<br/>We have to keep on hunting,<br/>much harder than before.<br/><br/>A little girl and her family celebrate Easter by visiting loved ones, eating a special meal, and going on an Easter egg hunt.<br/><br/>Nikki Shannon Smith's bouncy, rhythmic text and Ashley Evans's vivid, welcoming illustrations pair beautifully to create heartwarming scenes of everyday life. The joyful depiction of a Black family celebrating Easter traditions together will allow children to relate no matter how they celebrate!",Board book,"Children's Books, Growing Up & Facts of Life, Friendship, Social Skills & School Life, Literature & Fiction, Poetry, Early Learning"
9781368055055,3,3,"Rick Riordan Presents: Tristan Strong Keeps Punching-A Tristan Strong Novel, Book 3",Kwame Mbalia,Rick Riordan Presents,Children's,"Best-selling author Rick Riordan presents the finale of Kwame Mbalia's trilogy, in which Tristan Strong faces off with his archenemy, King Cotton, once and for all, now in paperback.<br/><br/>""Imagine if you combined Anansi the Spider, John Henry, and Marvel into, like, one book.""--New York Times best-selling author and Newbery Medalist Kwame Alexander<br/><br/>After reuniting with Ayanna, who is now in his world, Tristan travels up the Mississippi in pursuit of his archenemy, King Cotton. Along the way they encounter new haints who are dead set on preventing their progress north to Tristan's hometown of Chicago. It's going to take many Alkean friends, including the gods themselves, the black flames of the afokena gloves, and all of Tristan's inner strength to deliver justice once and for all.<br/><br/>Shocking twists, glorious triumphs, and a cast of unforgettable characters make this series conclusion as satisfying as it is entertaining.<br/><br/>Endorsed by Rick Riordan, author of Percy Jackson and the Olympians, soon to be a series on Disney+.<br/><br/>Complete your middle grade fantasy collection with these best-selling fan favorites: Rick Riordan Presents: Race to the Sun by Rebecca Roanhorse Rick Riordan Presents: City of the Plague God by Sarwat Chadda Rick Riordan Presents: Dragon Pearl by Yoon Ha Lee Rick Riordan Presents: Sal and Gabi Break the Universe by Carlos Hernandez The Percy Jackson and the Olympians series by Rick Riordan",Paperback,"Children's Books, Action & Adventure, Fairy Tales, Folk Tales & Myths, African, Science Fiction & Fantasy, Fantasy & Magic, Geography & Cultures, Multicultural Stories"
9781538706824,14,6,This Could Be Us,Kennedy Ryan,Forever,Non-Fiction,"“Heart-searing, sensual, and life affirming.” ―EMILY HENRY, #1 New York Times bestselling author<br/>An instant New York Times and USA Today bestseller, featured on The Today Show and CBS Mornings.<br/>Glamour: Best Books for Book Clubs<br/><br/>Soledad Barnes has her life all planned out. Because, of course, she does. She plans everything. She designs everything. She fixes everything. She’s a domestic goddess who's never met a party she couldn't host or a charge she couldn't lead. The one with all the answers and the perfect vinaigrette for that summer salad. But none of her varied talents can save her when catastrophe strikes, and the life she built with the man who was supposed to be her forever, goes poof in a cloud of betrayal and disillusion.<br/><br/>But there is no time to pout or sulk, or even grieve the life she lost. She's too busy keeping a roof over her daughters' heads and food on the table. And in the process of saving them all, Soledad rediscovers herself. From the ashes of a life burned to the ground, something bold and new can rise.<br/><br/>But then an unlikely man enters the picture—the forbidden one, the one she shouldn't want but can't seem to resist. She's lost it all before and refuses to repeat her mistakes. Can she trust him? Can she trust herself?<br/><br/>After all she's lost . . .and found . . .can she be brave enough to make room for what could be?<br/><br/>For fans of Tia Williams and Colleen Hoover comes a deeply moving and personal novel about sacrifice, self-reliance, and finding true happiness from “one of the finest romance writers of our age.” ―Entertainment Weekly<br/><br/>""A gorgeously grown-up romance and a story about self-love and reinvention...a great novel for readers who appreciate multilayered romantic fiction with elements of domestic drama, scandal, and inspiration."" ―NPR",Paperback,American literature
9781982197377,7,2,The House of Eve,Sadeqa Johnson,Simon & Schuster,Non-Fiction,"“Amazing…I was completely surprised by the ending of this beautifully told and written book.” —Reese Witherspoon<br/><br/>“A triumph of historical fiction” (The Washington Post), an instant New York Times bestseller, and a Reese’s Book Club pick, set in 1950s Philadelphia and Washington, DC, that explores what it means to be a woman and a mother, and how much one is willing to sacrifice to achieve her greatest goal.<br/><br/>1950s Philadelphia: fifteen-year-old Ruby Pearsall is on track to becoming the first in her family to attend college. But a taboo love affair threatens to pull her back down into the poverty and desperation that has been passed on to her like a birthright.<br/><br/>Eleanor Quarles arrives in Washington, DC, with ambition and secrets. When she meets the handsome William Pride at Howard University, they fall madly in love. But William hails from one of DC’s elite wealthy Black families, and his parents don’t let just anyone into their fold. Eleanor hopes that a baby will make her finally feel at home in William’s family and grant her the life she’s been searching for. But having a baby—and fitting in—is easier said than done.<br/><br/>With their stories colliding in the most unexpected of ways, Ruby and Eleanor will both make decisions that shape the trajectory of their lives.",Paperback,"Fiction, african american & black, historical, Fiction, african american & black, women"
