ISBN,Sales,Stores,Title,Authors,Publisher,Categories,Description,Binding,Subjects
9780684843261,6,2,For Colored Girls Who Have Considered Suicide When the Rainbow Is Enuf,Ntozake Shange,Scribner,Non-Fiction,"Ntozake Shange’s classic, award-winning play encompassing the wide-ranging experiences of Black women, now with introductions by two-time National Book Award winner Jesmyn Ward and Broadway director Camille A. Brown.<br/><br/>From its inception in California in 1974 to its Broadway revival in 2022, the Obie Award–winning for colored girls who have considered suicide/when the rainbow is enuf has excited, inspired, and transformed audiences all over the country for nearly fifty years. Passionate and fearless, Shange’s words reveal what it meant to be a woman of color in the 20th century.<br/><br/>First published in 1975, when it was praised by The New Yorker for “encompassing…every feeling and experience a woman has ever had,” for colored girls who have considered suicide/when the rainbow is enuf will be read and performed for generations to come. Now with new introductions by Jesmyn Ward and Broadway director Camille A. Brown, and one poem not included in the original, here is the complete text of a groundbreaking dramatic prose poem that resonates with unusual beauty in its fierce message to the world.",Paperback,African American women -- Poetry.
9780593527726,6,2,House of Marionne,J. Elle,G.P. Putnam's Sons Books for Young Readers,Young Adult,"An INSTANT New York Times bestseller!<br/>An INSTANT USA TODAY bestseller!<br/>An INSTANT Sunday Times bestseller!<br/><br/>A modern-day YA romantic fantasy series opener about a glamorous magical world of social elites, forbidden love, and a dark magic that could destroy it all.<br/><br/>""Dazzling and deceptive. The perfect escape!"" – Stephanie Garber, #1 New York Times bestselling author of The Ballad of Never After<br/><br/>""The forbidden love story of my wildest dreams!"" – Ali Hazelwood, New York Times bestselling author of The Love Hypothesis<br/><br/>BURY YOUR SECRET OR DIE FOR IT.<br/><br/>17-year-old Quell has lived her entire life on the run. She and her mother have fled from city to city in order to hide the deadly magic that flows through Quell’s veins.<br/><br/>Until someone discovers her dark secret.<br/><br/>To hide from the assassin hunting her and keep her mother out of harm’s way, Quell reluctantly inducts into a debutante society of magical social elites called the Order that she never knew existed. If she can pass their three rites of membership, mastering their proper form of magic, she’ll be able to secretly bury her forbidden magic forever.<br/><br/>If caught, she will be killed.<br/><br/>But becoming the perfect debutante is a lot harder than Quell imagined, especially when there’s more than tutoring happening with Jordan, her brooding mentor and assassin-in-training.<br/><br/>When Quell uncovers the deadly lengths the Order will go to defend its wealth and power, she’s forced to choose: Embrace the dark magic she’s been running from her entire life, or risk losing everything, and everyone, she’s grown to love.<br/><br/>Still, she fears the most formidable monster she’ll have to face is the one inside.<br/><br/>Brimming with ballgowns and betrayal, magic and mystery, decadence and darkness, House of Marionne is perfect for readers who crave morally gray characters, irresistible romance, dark academia, and a deeply intoxicating and original world.",Paperback,"Teen & Young Adult, Literature & Fiction, Science Fiction & Fantasy, Fantasy, Romance, Paranormal"
9780063141513,4,3,Honey and Spice: A Reese's Book Club Pick,Bolu Babalola,William Morrow Paperbacks,Fiction,"INSTANT NATIONAL BESTSELLER • A REESE'S BOOK CLUB PICK • A TIKTOK BOOK CLUB PICK<br/>""Sexy, messy and wry, Honey and Spice more than delivers."" — New York Times Book Review<br/>""A vibrant debut novel . . . Babalola is incisively funny, capturing the kick and sweetness of her title with her words."" — Entertainment Weekly<br/>Named a Best Book of the Year by Time • Esquire • Vanity Fair • Oprah Daily • Cosmopolitan • Elle • Harper's Bazaar • Southern Living • Buzzfeed • Women's Health Magazine • AudioFile • Popsugar • and more!<br/>Introducing internationally bestselling author Bolu Babalola’s dazzling debut novel, full of passion, humor, and heart, that centers on a young Black British woman who has no interest in love and unexpectedly finds herself caught up in a fake relationship with the man she warned her girls about<br/>Sweet like plantain, hot like pepper. They taste the best when together...<br/>Sharp-tongued (and secretly soft-hearted) Kiki Banjo has just made a huge mistake. As an expert in relationship-evasion and the host of the popular student radio show Brown Sugar, she’s made it her mission to make sure the women of the African-Caribbean Society at Whitewell University do not fall into the mess of “situationships”, players, and heartbreak. But when the Queen of the Unbothered kisses Malakai Korede, the guy she just publicly denounced as “The Wastemen of Whitewell,” in front of every Blackwellian on campus, she finds her show on the brink.<br/>They’re soon embroiled in a fake relationship to try and salvage their reputations and save their futures. Kiki has never surrendered her heart before, and a player like Malakai won’t be the one to change that, no matter how charming he is or how electric their connection feels. But surprisingly entertaining study sessions and intimate, late-night talks at old-fashioned diners force Kiki to look beyond her own presumptions. Is she ready to open herself up to something deeper?<br/>A gloriously funny and sparkling debut novel, Honey and Spice is full of delicious tension and romantic intrigue that will make you weak at the knees.<br/>""A smart, sexy summer read, which hits your brain and your romance buttons in one shot."" — Los Angeles Times<br/>""The ultimate summer romance . . . It’s got all the juiciest, most satisfying romance tropes, but in Babalola’s capable hands, the story feels fresh and unique."" — The Cut, New York magazine<br/>“Divine summer reading. Hilarious, hot, and heartfelt. ” — Meg Cabot, #1 New York Times bestselling author",Paperback,"Literature & Fiction, Genre Fiction, Historical, Coming of Age, Feel-Good, United States, Black & African American, Romance, Romantic Comedy"
9780593232743,4,3,Get Good with Money: Ten Simple Steps to Becoming Financially Whole,Tiffany the Budgetnista Aliche,Rodale Books,Non-Fiction,"NEW YORK TIMES, WALL STREET JOURNAL, AND USA TODAY BESTSELLER • A ten-step plan for finding peace, safety, and harmony with your money—no matter how big or small your goals and no matter how rocky the market might be—by the inspiring and savvy “Budgetnista.”<br/><br/>“No matter where you stand in your money journey, Get Good with Money has a lesson or two for you!”—Erin Lowry,bestselling author of the Broke Millennial series<br/><br/>Tiffany Aliche was a successful pre-school teacher with a healthy nest egg when a recession and advice from a shady advisor put her out of a job and into a huge financial hole. As she began to chart the path to her own financial rescue, the outline of her ten-step formula for attaining both financial security and peace of mind began to take shape. These principles have now helped more than one million women worldwide answer their most pressing financial questions: How to pay off debt? How to save money? How to build wealth?<br/><br/>Revealing this practical ten-step process for the first time in its entirety, Get Good with Money introduces the powerful concept of building wealth through financial wholeness: a realistic, achievable, and energizing alternative to get-rich-quick and over-complicated money management systems. With helpful checklists, worksheets, a tool kit of resources, and advanced advice from experts who Tiffany herself relies on (her “Budgetnista Boosters”), Get Good with Money gets crystal clear on the short-term actions that lead to long-term goals, including:<br/><br/>• A simple technique to determine your baseline or “noodle budget,” examine and systemize your expenses, and lay out a plan that allows you to say yes to your dreams.<br/>• An assessment tool that helps you understand whether you have a “don't make enough” problem or a “spend too much” issue—as well as ways to fix both.<br/>• Best practices for saving for a rainy day (aka job loss), a big-ticket item (a house, a trip, a car), and money that can be invested for your future.<br/>• Detailed advice and action steps for taking charge of your credit score, maximizing bill-paying automation, savings and investing, and calculating your life, disability, and property insurance needs.<br/>• Ways to protect your beneficiaries' future, and ensure that your financial wishes will stand the test of time.<br/><br/>An invaluable guide to cultivating good financial habits and making your money work for you, Get Good with Money will help you build a solid foundation for your life (and legacy) that’s rich in every way.",Hardcover,"Self-Help, Success, Business & Money, Investing, Introduction, Personal Finance, Budgeting & Money Management"
9781728254326,6,2,This Book Is Gay,Juno Dawson,Sourcebooks Fire,Young Adult,"The bestselling young adult non-fiction book on sexuality and gender!<br/>Lesbian. Gay. Bisexual. Transgender. Queer. Intersex. Straight. Curious. This book is for everyone, regardless of gender or sexual preference. This book is for anyone who's ever dared to wonder. This book is for YOU.<br/>This candid, funny, and uncensored exploration of sexuality and what it's like to grow up LGBTQ also includes real stories from people across the gender and sexual spectrums, not to mention hilarious illustrations.<br/>Inside this revised and updated edition, you'll find the answers to all the questions you ever wanted to ask, with topics like: Stereotypes―the facts and fiction Coming out as LGBT Where to meet people like you The ins and outs of gay sex How to flirt And so much more!<br/>You will be entertained. You will be informed. But most importantly, you will know that however you identify (or don't) and whomever you love, you are exceptional. You matter. And so does this book.<br/>This book is for: LGBTQIA+ teens, tweens, and adults Readers looking to learn more about the LGBTQIA+ community Parents of gay kids and other LGBT youth Educators looking for advice about the LGBTQIA+ community<br/>Praise for This Book is Gay:<br/>A Guardian Best Book of the Year<br/>2018 Garden State Teen Book Award Winner<br/>""The book every LGBT person would have killed for as a teenager, told in the voice of a wise best friend. Frank, warm, funny, USEFUL.""―Patrick Ness, New York Times bestselling author<br/>""This egregious gap has now been filled to a fare-thee-well by Dawson's book.""―Booklist *STARRED REVIEW*<br/>Coming soon from Juno Dawson: What's The T? (June 2022) The companion title to the groundbreaking This Book Is Gay, What's the T? tackles the complex realities of growing up trans with honesty and humor and is joyfully illustrated by gender non-conforming artist Soofiya.",Paperback,"LGBTQ+ Books, Teen & Young Adult, Social Issues, Dating & Intimacy, LGBTQ+ Issues"
9781608465644,8,2,"Freedom Is a Constant Struggle: Ferguson, Palestine, and the Foundations of a Movement",Angela Y. Davis,Haymarket Books,Non-Fiction,"In these newly collected essays, interviews, and speeches, world-renowned activist and scholar Angela Y. Davis illuminates the connections between struggles against state violence and oppression throughout history and around the world.<br/><br/>Reflecting on the importance of black feminism, intersectionality, and prison abolitionism for today's struggles, Davis discusses the legacies of previous liberation struggles, from the Black Freedom Movement to the South African anti-Apartheid movement. She highlights connections and analyzes today's struggles against state terror, from Ferguson to Palestine.<br/><br/>Facing a world of outrageous injustice, Davis challenges us to imagine and build the movement for human liberation. And in doing so, she reminds us that ""Freedom is a constant struggle.""<br/><br/>Angela Y. Davis is a political activist, scholar, author, and speaker. She is an outspoken advocate for the oppressed and exploited, writing on Black liberation, prison abolition, the intersections of race, gender, and class, and international solidarity with Palestine. She is the author of several books, including Women, Race, and Class and Are Prisons Obsolete? She is the subject of the acclaimed documentary Free Angela and All Political Prisoners and is Distinguished Professor Emerita at the University of California, Santa Cruz.<br/><br/>One of America's most provocative public intellectuals, Dr. Cornel West has been a champion for racial justice since childhood. His writing, speaking, and teaching weave together the traditions of the black Baptist Church, progressive politics, and jazz. The New York Times has praised his ""ferocious moral vision."" His many books include Race Matters, Democracy Matters, and his autobiography, Brother West: Living and Loving Out Loud.<br/><br/>Frank Barat is a human rights activist and author. He was the coordinator of the Russell Tribunal on Palestine and is now the president of the Palestine Legal Action Network. His books include Gaza in Crisis and Corporate Complicity in Israel's Occupation.",Paperback,"History, Americas, Canada, Politics & Social Sciences, Social Sciences, Ethnic Studies, Politics & Government, International & World Politics, Specific Topics"
9781335090416,14,5,Isaac's Song: A Novel,Daniel Black,Hanover Square Press,Fiction,"*From the Viral Clark Atlanta University Commencement Speaker*<br/>*From the Georgia Author of the Year Award Winner*<br/><br/>The beloved author of Don’t Cry for Me and Perfect Peace returns with a poignant, emotionally exuberant novel about a young queer Black man finding his voice in 1980s Chicago—a novel of family, forgiveness and perseverance, for fans of The Great Believers and On Earth We're Briefly Gorgeous<br/><br/>Isaac is at a crossroads in his young life. Growing up in Missouri, the son of a caustic, hard-driving father, he was conditioned to suppress his artistic pursuits and physical desires, notions that didn’t align with a traditional view of masculinity. But now, in late ’80s Chicago, Isaac has finally carved out a life of his own. He is sensitive and tenderhearted and has built up the courage to seek out a community. Yet just as he begins to embrace who he is, two social catalysts—the AIDS crisis and Rodney King’s attack—collectively extinguish his hard-earned joy.<br/><br/>At a therapist’s encouragement, Isaac begins to write down his story. In the process, he taps into a creative energy that will send him on a journey back to his family, his ancestral home in Arkansas and the inherited trauma of the nation’s dark past. But a surprise discovery will either unlock the truths he’s seeking or threaten to derail the life he’s fought so hard to claim.<br/><br/>Poignant, sweeping and luminously told, Isaac's Song is a return to the beloved characters of Don’t Cry for Me and a high-water mark in the career of an award-winning author.",Hardcover,"LGBTQ+ Books, Literature & Fiction, Genre Fiction, United States, Black & African American, Southern, Literary"
9781538751480,5,3,"Wild Seed (Patternist, 1)",Octavia E. Butler,Grand Central Publishing,Non-Fiction,"In an ""epic, game-changing, moving and brilliant"" story of love and hate, two immortals chase each other across continents and centuries, binding their fates together -- and changing the destiny of the human race (Viola Davis).<br/><br/>Doro knows no higher authority than himself. An ancient spirit with boundless powers, he possesses humans, killing without remorse as he jumps from body to body to sustain his own life. With a lonely eternity ahead of him, Doro breeds supernaturally gifted humans into empires that obey his every desire. He fears no one -- until he meets Anyanwu.<br/><br/>Anyanwu is an entity like Doro and yet different. She can heal with a bite and transform her own body, mending injuries and reversing aging. She uses her powers to cure her neighbors and birth entire tribes, surrounding herself with kindred who both fear and respect her. No one poses a true threat to Anyanwu -- until she meets Doro.<br/><br/>The moment Doro meets Anyanwu, he covets her; and from the villages of 17th-century Nigeria to 19th-century United States, their courtship becomes a power struggle that echoes through generations, irrevocably changing what it means to be human.",Paperback,"Literature & Fiction, United States, Black & African American, Literary, Science Fiction & Fantasy, Fantasy, Epic, Historical, Romantic, Science Fiction, Genetic Engineering"
9780593448809,8,2,There's Always This Year: On Basketball and Ascension,Hanif Abdurraqib,Random House Trade Paperbacks,Non-Fiction,"LONGLISTED FOR THE NATIONAL BOOK AWARD • #1 NATIONAL BESTSELLER • A “powerful” (The Guardian) reflection on basketball, life, and home—from the author of the National Book Award finalist A Little Devil in America<br/><br/>“Mesmerizing . . . not only the most original sports book I’ve ever read but one of the most moving books I’ve ever read, period.”—Steve James, director of Hoop Dreams<br/><br/>ONE OF THE TEN BEST BOOKS OF THE YEAR: Vulture, Chicago Public Library, BookPage<br/><br/>A BEST BOOK OF THE YEAR: The New York Times Book Review, Time, The Washington Post, NPR, The Boston Globe, The New York Public Library, Chicago Public Library, Publishers Weekly, Kirkus Reviews, Book Riot, Electric Lit<br/><br/>Growing up in Columbus, Ohio, in the 1990s, Hanif Abdurraqib witnessed a golden era of basketball, one in which legends like LeBron James were forged and countless others weren’t. His lifelong love of the game leads Abdurraqib into a lyrical, historical, and emotionally rich exploration of what it means to make it, who we think deserves success, the tension between excellence and expectation, and the very notion of role models, all of which he expertly weaves together with intimate, personal storytelling. “Here is where I would like to tell you about the form on my father’s jump shot,” Abdurraqib writes. “The truth, though, is that I saw my father shoot a basketball only one time.”<br/><br/>There’s Always This Year is a triumph, brimming with joy, pain, solidarity, comfort, outrage, and hope. No matter the subject of his keen focus—whether it’s basketball, or music, or performance—Hanif Abdurraqib’s exquisite writing is always poetry, always profound, and always a clarion call to radically reimagine how we think about our culture, our country, and ourselves.<br/><br/>LONGLISTED FOR THE ANDREW CARNEGIE MEDAL FOR EXCELLENCE IN NONFICTION AND THE NATIONAL BOOK CRITICS CIRCLE AWARD",Paperback,"Biographies & Memoirs, Community & Culture, Black & African American, Memoirs, Sports & Outdoors, Basketball, Biographies, Politics & Social Sciences, Social Sciences, Ethnic Studies, Sociology, Reference"
9780345804341,7,4,The Nickel Boys: A Novel,Colson Whitehead,Anchor,Fiction,"PULITZER PRIZE WINNER • NATIONAL BESTSELLER • This follow-up to The Underground Railroad brilliantly dramatizes another strand of American history through the story of two boys unjustly sentenced to a hellish reform school in Jim Crow-era Florida. • ""One of the most gifted novelists in America today."" —NPR<br/><br/>When Elwood Curtis, a black boy growing up in 1960s Tallahassee, is unfairly sentenced to a juvenile reformatory called the Nickel Academy, he finds himself trapped in a grotesque chamber of horrors. Elwood’s only salvation is his friendship with fellow “delinquent” Turner, which deepens despite Turner’s conviction that Elwood is hopelessly naive, that the world is crooked, and that the only way to survive is to scheme and avoid trouble. As life at the Academy becomes ever more perilous, the tension between Elwood’s ideals and Turner’s skepticism leads to a decision whose repercussions will echo down the decades.<br/><br/>Based on the real story of a reform school that operated for 111 years and warped the lives of thousands of children, The Nickel Boys is a devastating, driven narrative that showcases a great American novelist writing at the height of his powers and “should further cement Whitehead as one of his generation's best"" (Entertainment Weekly).<br/><br/>Look for Colson Whitehead’s new novel, Crook Manifesto!",Paperback,"Literature & Fiction, Genre Fiction, Historical, United States, Black & African American, Literary, Mystery, Thriller & Suspense, Mystery, Hard-Boiled, Thrillers & Suspense, Crime"
9781481438292,7,2,Look Both Ways: A Tale Told in Ten Blocks,Jason Reynolds,Atheneum/Caitlyn Dlouhy Books,Children's,"UK Carnegie Medal winner<br/>A National Book Award Finalist<br/>Coretta Scott King Author Honor Book<br/>An NPR Favorite Book of 2019<br/>A New York Times Best Children’s Book of 2019<br/>A Time Best Children’s Book of 2019<br/>A Today Show Best Kids’ Book of 2019<br/>A Washington Post Best Children’s Book of 2019<br/>A School Library Journal Best Middle Grade Book of 2019<br/>A Publishers Weekly Best Book of 2019<br/>A Kirkus Reviews Best Middle Grade Book of 2019<br/>“As innovative as it is emotionally arresting.” —Entertainment Weekly<br/><br/>From National Book Award finalist and #1 New York Times bestselling author Jason Reynolds comes a novel told in ten blocks, showing all the different directions kids’ walks home can take.<br/><br/>This story was going to begin like all the best stories. With a school bus falling from the sky. But no one saw it happen. They were all too busy—<br/><br/>Talking about boogers.<br/>Stealing pocket change.<br/>Skateboarding.<br/>Wiping out.<br/>Braving up.<br/>Executing complicated handshakes.<br/>Planning an escape.<br/>Making jokes.<br/>Lotioning up.<br/>Finding comfort.<br/>But mostly, too busy walking home.<br/><br/>Jason Reynolds conjures ten tales (one per block) about what happens after the dismissal bell rings, and brilliantly weaves them into one wickedly funny, piercingly poignant look at the detours we face on the walk home, and in life.",Paperback,"Children's Books, Growing Up & Facts of Life, Family Life, Friendship, Social Skills & School Life, Literature & Fiction, Short Story Collections, Humor"
9780385550369,35,4,James: A Novel,Percival Everett,Doubleday,Fiction,"AN INSTANT NEW YORK TIMES BESTSELLER • NAMED A BEST BOOK OF THE YEAR SO FAR FOR 2024 BY THE NEW YORK TIMES BOOK REVIEW • A brilliant, action-packed reimagining of Adventures of Huckleberry Finn, both harrowing and darkly humorous, told from the enslaved Jim's point of view<br/><br/>""Genius""—The Atlantic • ""A masterpiece that will help redefine one of the classics of American literature, while also being a major achievement on its own.""—Chicago Tribune • ""A provocative, enlightening literary work of art.""—The Boston Globe • ""Everett’s most thrilling novel, but also his most soulful.""—The New York Times<br/><br/>When the enslaved Jim overhears that he is about to be sold to a man in New Orleans, separated from his wife and daughter forever, he decides to hide on nearby Jackson Island until he can formulate a plan. Meanwhile, Huck Finn has faked his own death to escape his violent father, recently returned to town. As all readers of American literature know, thus begins the dangerous and transcendent journey by raft down the Mississippi River toward the elusive and too-often-unreliable promise of the Free States and beyond.<br/><br/>While many narrative set pieces of Adventures of Huckleberry Finn remain in place (floods and storms, stumbling across both unexpected death and unexpected treasure in the myriad stopping points along the river’s banks, encountering the scam artists posing as the Duke and Dauphin…), Jim’s agency, intelligence and compassion are shown in a radically new light.<br/><br/>Brimming with the electrifying humor and lacerating observations that have made Everett a “literary icon” (Oprah Daily), and one of the most decorated writers of our lifetime, James is destined to be a major publishing event and a cornerstone of twenty-first century American literature.",Hardcover,"Literature & Fiction, Genre Fiction, Historical, United States, Humor & Satire, Satire, Literary"
