ISBN,Sales,Stores,Title,Authors,Publisher,Categories,Description,Binding,Subjects
9780807057834,6,3,An Indigenous Peoples' History of the United States (REVISIONING HISTORY),Roxanne Dunbar-Ortiz,Beacon Press,Non-Fiction,"New York Times Bestseller<br/><br/>Now part of the HBO docuseries ""Exterminate All the Brutes,"" written and directed by Raoul Peck<br/><br/>Recipient of the American Book Award<br/><br/>The first history of the United States told from the perspective of indigenous peoples<br/><br/>Today in the United States, there are more than five hundred federally recognized Indigenous nations comprising nearly three million people, descendants of the fifteen million Native people who once inhabited this land. The centuries-long genocidal program of the US settler-colonial regimen has largely been omitted from history. Now, for the first time, acclaimed historian and activist Roxanne Dunbar-Ortizoffers a history of the United States told from the perspective of Indigenous peoples and reveals how Native Americans, for centuries, actively resisted expansion of the US empire.<br/><br/>With growing support for movements such as the campaign to abolish Columbus Day and replace it with Indigenous Peoples’ Day and the Dakota Access Pipeline protest led by the Standing Rock Sioux Tribe, An Indigenous Peoples’ History of the United States is an essential resource providing historical threads that are crucial for understanding the present. In An Indigenous Peoples’ History of the United States, Dunbar-Ortiz adroitly challenges the founding myth of the United States and shows how policy against the Indigenous peoples was colonialist and designed to seize the territories of the original inhabitants, displacing or eliminating them. And as Dunbar-Ortiz reveals, this policy was praised in popular culture, through writers like James Fenimore Cooper and Walt Whitman, and in the highest offices of government and the military. Shockingly, as the genocidal policy reached its zenith under President Andrew Jackson, its ruthlessness was best articulated by US Army general Thomas S. Jesup, who, in 1836, wrote of the Seminoles: “The country can be rid of them only by exterminating them.”<br/><br/>Spanning more than four hundred years, this classic bottom-up peoples’ history radically reframes US history and explodes the silences that have haunted our national narrative.<br/><br/>An Indigenous Peoples' History of the United States is a 2015 PEN Oakland-Josephine Miles Award for Excellence in Literature.",Paperback,"History, Americas, Native American, Politics & Social Sciences, Social Sciences, Ethnic Studies"
9780807006238,6,2,A Boy's Will,Robert Frost,Henry Holt and Company,Non-Fiction,"#26 on The Guardian's list of 100 best nonfiction books of all time, the essays explore what it means to be Black in America<br/><br/>In an age of Black Lives Matter, James Baldwin's essays on life in Harlem, the protest novel, movies, and African Americans abroad are as powerful today as when they were first written. With films like I Am Not Your Negro and the forthcoming If Beale Street Could Talk bringing renewed interest to Baldwin's life and work, Notes of a Native Son serves as a valuable introduction.<br/>Written during the 1940s and early 1950s, when Baldwin was only in his twenties, the essays collected in Notes of a Native Son capture a view of black life and black thought at the dawn of the civil rights movement and as the movement slowly gained strength through the words of one of the most captivating essayists and foremost intellectuals of that era. Writing as an artist, activist, and social critic, Baldwin probes the complex condition of being black in America. With a keen eye, he examines everything from the significance of the protest novel to the motives and circumstances of the many black expatriates of the time, from his home in “The Harlem Ghetto” to a sobering “Journey to Atlanta.”<br/><br/>Notes of a Native Son inaugurated Baldwin as one of the leading interpreters of the dramatic social changes erupting in the United States in the twentieth century, and many of his observations have proven almost prophetic. His criticism on topics such as the paternalism of white progressives or on his own friend Richard Wright’s work is pointed and unabashed. He was also one of the few writing on race at the time who addressed the issue with a powerful mixture of outrage at the gross physical and political violence against black citizens and measured understanding of their oppressors, which helped awaken a white audience to the injustices under their noses. Naturally, this combination of brazen criticism and unconventional empathy for white readers won Baldwin as much condemnation as praise.<br/><br/>Notes is the book that established Baldwin’s voice as a social critic, and it remains one of his most admired works. The essays collected here create a cohesive sketch of black America and reveal an intimate portrait of Baldwin’s own search for identity as an artist, as a black man, and as an American.",Hardcover,"Social conditions, Civil rights, African Americans, Race relations"
9781534441613,24,5,Legendborn (The Legendborn Cycle),Tracy Deonn,Margaret K. McElderry Books,Young Adult,"An Instant New York Times Bestseller!<br/>Winner of the Coretta Scott King - John Steptoe for New Talent Author Award<br/><br/>Filled with mystery and an intriguingly rich magic system, Tracy Deonn’s YA contemporary fantasy reinvents the King Arthur legend and “braids together Southern folk traditions and Black Girl Magic into a searing modern tale of grief, power, and self-discovery” (Dhonielle Clayton, New York Times bestselling author of The Belles).<br/><br/>After her mother dies in an accident, sixteen-year-old Bree Matthews wants nothing to do with her family memories or childhood home. A residential program for bright high schoolers at UNC–Chapel Hill seems like the perfect escape—until Bree witnesses a magical attack her very first night on campus.<br/><br/>A flying demon feeding on human energies.<br/><br/>A secret society of so called “Legendborn” students that hunt the creatures down.<br/><br/>And a mysterious teenage mage who calls himself a “Merlin” and who attempts—and fails—to wipe Bree’s memory of everything she saw.<br/><br/>The mage’s failure unlocks Bree’s own unique magic and a buried memory with a hidden connection: the night her mother died, another Merlin was at the hospital. Now that Bree knows there’s more to her mother’s death than what’s on the police report, she’ll do whatever it takes to find out the truth, even if that means infiltrating the Legendborn as one of their initiates.<br/><br/>She recruits Nick, a self-exiled Legendborn with his own grudge against the group, and their reluctant partnership pulls them deeper into the society’s secrets—and closer to each other. But when the Legendborn reveal themselves as the descendants of King Arthur’s knights and explain that a magical war is coming, Bree has to decide how far she’ll go for the truth and whether she should use her magic to take the society down—or join the fight.<br/><br/>This paperback edition of Legendborn contains a teaser to the thrilling sequel, Bloodmarked, as well as an exclusive short story from Selwyn Kane's perspective!",Paperback,"Teen & Young Adult, Literature & Fiction, Science Fiction & Fantasy, Fantasy, Romance, Contemporary, Historical, Science Fiction & Dystopian"
9780062913234,5,3,Illustrated Black History: Honoring the Iconic and the Unseen,George McCalman,HarperOne,Non-Fiction,"*AWARD WINNER* of the NAACP Image Award for Outstanding Literary Work - Debut Author / and the NCBR Recognition Award<br/>A gorgeous collection of 145 original portraits that celebrates Black pioneers—famous and little-known--in politics, science, literature, music, and more—with biographical reflections, all created and curated by an award-winning graphic designer.<br/>Illustrated Black History is a breathtaking collection of original portraits depicting black heroes—both famous and unsung—who made their mark on activism, science, politics, business, medicine, technology, food, arts, entertainment, and more. Each entry includes a lush drawing or painting by artist George McCalman, along with an insightful essay summarizing the person’s life story.<br/>The 145 entries range from the famous to the little-known, from literary luminary James Baldwin to documentarian Madeline Anderson, who produced “I Am Somebody” about the 1969 strike of mostly female hospital workers; from Aretha Franklin to James and Eloyce Gist, who had a traveling ministry in the early 1900s; from Colin Kaepernick to Guion S. Bluford, the first Black person to travel into space.<br/>Beautifully designed with over 300 unique four-color artworks and accessible to readers of all ages, this eye-opening, educational, dynamic, and timely compendium pays homage to Black Americans and their achievements, and showcases the depth and breadth of Black genius.",Hardcover,"Arts & Photography, History & Criticism, Criticism, Graphic Design, Commercial, Biographies & Memoirs, Community & Culture, Black & African American, Historical, United States, History, Americas, Historical Study & Educational Resources, Reference, Encyclopedias & Subject Guides, Art, Politics & Social Sciences, Social Sciences, Ethnic Studies, Education & Teaching"
9780593729908,13,3,Lovely One: A Memoir,Ketanji Brown Jackson,Random House,Non-Fiction,"In her inspiring, intimate memoir, the first Black woman to ever be appointed to the Supreme Court of the United States chronicles her extraordinary life story.<br/><br/>With this unflinching account, Justice Ketanji BrownJackson invites readers into her life and world, tracing her family’s ascent from segregation to her confirmation on America’s highest court within the span of one generation.<br/><br/>Named “Ketanji Onyika,” meaning “Lovely One,” based on a suggestion from her aunt, a Peace Corps worker stationed in West Africa, Justice Jackson learned from her educator parents to take pride in her heritage since birth. She describes her resolve as a young girl to honor this legacy and realize her dreams: from hearing stories of her grandparents and parents breaking barriers in the segregated South, to honing her voice in high school as an oratory champion and student body president, to graduating magna cum laude from Harvard, where she performed in musical theater and improv and participated in pivotal student organizations.<br/><br/>Here, Justice Jackson pulls back the curtain, marrying the public record of her life with what is less known. She reveals what it takes to advance in the legal profession when most people in power don’t look like you, and to reconcile a demanding career with the joys and sacrifices of marriage and motherhood.<br/><br/>Through trials and triumphs, Justice Jackson’s journey will resonate with dreamers everywhere, especially those who nourish outsized ambitions and refuse to be turned aside. This moving, openhearted tale will spread hope for a more just world, for generations to come.",Hardcover,"Biographies & Memoirs, Community & Culture, Women, Memoirs, Professionals & Academics, Lawyers & Judges"
9780062397348,4,3,"People's History of the United States, A",Howard Zinn,Harper Perennial Modern Classics,Non-Fiction,"THE CLASSIC NATIONAL BESTSELLER<br/>""A wonderful, splendid book—a book that should be read by every American, student or otherwise, who wants to understand his country, its true history, and its hope for the future."" –Howard Fast<br/>Historian Howard Zinn’s A People’s History of the United States chronicles American history from the bottom up, throwing out the official narrative taught in schools—with its emphasis on great men in high places—to focus on the street, the home, and the workplace.<br/>Known for its lively, clear prose as well as its scholarly research, itis the only volume to tell America's story from the point of view of—and in the words of—America's women, factory workers, African-Americans, Native Americans, the working poor, and immigrant laborers. As Zinn shows, many of our country's greatest battles—the fights for a fair wage, an eight-hour workday, child-labor laws, health and safety standards, universal suffrage, women's rights, racial equality—were carried out at the grassroots level, against bloody resistance.<br/>Covering Christopher Columbus's arrival through President Clinton's first term, A People's History of the United States features insightful analysis of the most important events in our history. This edition also includes an introduction by Anthony Arnove, who wrote, directed, and produced The People Speak with Zinn and who coauthored, with Zinn, Voices of a People’s History of the United States.",Paperback,"History, Americas, United States, Historical Study & Educational Resources, Reference, Politics & Social Sciences, Social Sciences, Politics & Government, Ideologies & Doctrines, Self Service, Custom Stores"
9780316365550,13,2,We Will Rest!: The Art of Escape,Tricia Hersey,"Little, Brown Spark",Non-Fiction,"Escape from grind culture and dehumanizing systems with this visionary guide from the author of the New York Times bestseller Rest Is Resistance<br/><br/>We don’t believe we are worthy of rest unless we burn ourselves out to accomplish it. Our thinking has been limited by disconnection, sleep deprivation, and the unattainable call for perfection. The systems will never give us rest. It is something we must create for ourselves and each other.<br/><br/>Just as the North Star guided the enslaved on their journeys to freedom, visionary artist and founder of The Nap Ministry Tricia Hersey leads us to imagine a new world: one in which we subvert the narrative of productivity at all costs and embrace rest as a healing spiritual practice.<br/><br/>Inspired by vintage hymnals, prayer books, and abolitionist pamphlets, We Will Rest! is a modern sacred object, medicine for a sick and exhausted world. Weaving together meditations and poetry with storytelling and powerful art, Hersey provokes liberation through refusal and trickster rebellion in the face of capitalism and white supremacy.<br/><br/>There is another way. Focus on the escape. Focus on the transformation. We can just be. We are beautiful. We are enough. We are escape artists. We Will Rest!<br/><br/>***<br/><br/>Have you ever noticed<br/>when you ask for rest<br/>the body becomes a holy trumpet<br/>the walls come tumbling down?",Hardcover,"Self-Help, Personal Transformation, Self-Esteem, Health, Fitness & Dieting, Diseases & Physical Ailments, Sleep Disorders, Religion & Spirituality"
9781571313560,6,2,"Braiding Sweetgrass: Indigenous Wisdom, Scientific Knowledge and the Teachings of Plants",Robin Wall Kimmerer,Milkweed Editions,Non-Fiction,"A New York Times Bestseller<br/>A Washington Post Bestseller<br/>Named a ""Best Essay Collection of the Decade"" by Literary Hub<br/><br/>As a botanist, Robin Wall Kimmerer has been trained to ask questions of nature with the tools of science. As a member of the Citizen Potawatomi Nation, she embraces the notion that plants and animals are our oldest teachers. In Braiding Sweetgrass, Kimmerer brings these two lenses of knowledge together to take us on “a journey that is every bit as mythic as it is scientific, as sacred as it is historical, as clever as it is wise” (Elizabeth Gilbert).<br/><br/>Drawing on her life as an indigenous scientist, and as a woman, Kimmerer shows how other living beings―asters and goldenrod, strawberries and squash, salamanders, algae, and sweetgrass―offer us gifts and lessons, even if we've forgotten how to hear their voices. In reflections that range from the creation of Turtle Island to the forces that threaten its flourishing today, she circles toward a central argument: that the awakening of ecological consciousness requires the acknowledgment and celebration of our reciprocal relationship with the rest of the living world. For only when we can hear the languages of other beings will we be capable of understanding the generosity of the earth, and learn to give our own gifts in return.",Paperback,"Science & Math, Biological Sciences, Botany, Ecology, Plants, History & Philosophy, Nature & Ecology, Nature Writing & Essays, Politics & Social Sciences, Social Sciences, Ethnic Studies"
9780809024377,7,2,"Nat Turner, Black Prophet: A Visionary History",Anthony E. Kaye,"Farrar, Straus and Giroux",Non-Fiction,A New History Of Nat Turner's Rebellion And Its Aftermath-- Provided By Publisher.,Hardcover,"Biographies & Memoirs, Community & Culture, Black & African American, Historical, United States, History, Americas, Politics & Social Sciences, Sociology, Race Relations"
9781250294623,13,4,"Children of Blood and Bone (Legacy of Orisha, 1)",Tomi Adeyemi,Square Fish,Young Adult,"An Instant #1 New York Times Bestseller<br/>A TIME Top 100 Fantasy Books of All Time<br/>A New York Times Notable Children's Book<br/>A Kirkus Prize Finalist<br/>Five Starred Reviews<br/><br/>Now available in a deluxe paperback edition with gorgeous spray-painted and stenciled edges, Tomi Adeyemi’s groundbreaking West African-inspired fantasy debut, and instant #1 New York Times Bestseller, conjures a world of magic and danger, perfect for fans of Leigh Bardugo and Sabaa Tahir.<br/><br/>They killed my mother.<br/>They took our magic.<br/>They tried to bury us.<br/><br/>Now we rise.<br/><br/>Zélie Adebola remembers when the soil of Orïsha hummed with magic. Burners ignited flames, Tiders beckoned waves, and Zélie’s Reaper mother summoned forth souls.<br/><br/>But everything changed the night magic disappeared. Under the orders of a ruthless king, maji were killed, leaving Zélie without a mother and her people without hope.<br/><br/>Now Zélie has one chance to bring back magic and strike against the monarchy. With the help of a rogue princess, Zélie must outwit and outrun the crown prince, who is hell-bent on eradicating magic for good.<br/><br/>Danger lurks in Orïsha, where snow leoponaires prowl and vengeful spirits wait in the waters. Yet the greatest danger may be Zélie herself as she struggles to control her powers and her growing feelings for an enemy.<br/><br/>Praise for Children of Blood and Bone<br/><br/>""A phenomenon."" ―Entertainment Weekly<br/><br/>“The epic I’ve been waiting for.” ―New York Times-bestselling author Marie Lu<br/><br/>“You will be changed. You will be ready to rise up and reclaim your own magic!” ―New York Times-bestselling author Dhonielle Clayton<br/><br/>“The next big thing in literature and film.” ―Ebony<br/><br/>“One of the biggest young adult fiction debut book deals of the year.” ―Teen Vogue<br/><br/>This title has Common Core connections.<br/><br/>-<br/><br/>The Complete Legacy of Orïsha Series:<br/><br/>Children of Blood and Bone (Book 1)<br/>Children of Virtue and Vengeance (Book 2)<br/>Children of Anguish and Anarchy (Book 3)",Paperback,"Teen & Young Adult, Literature & Fiction, Action & Adventure, Social & Family Issues, Science Fiction & Fantasy, Fantasy"
9780063222465,5,2,Becoming a Ballerina: The Story of Michaela Mabinty DePrince,Laura Obuobi,HarperCollins,Children's,"From Laura Obuobi, acclaimed author of NAACP Image Award nominee Black Gold and What Love Looks Like, comes a triumphant nonfiction picture book about ballet star Michaela Mabinty DePrince, one of the most celebrated ballerinas of our generation. This lyrical true tale follows her childhood, from Sierra Leone orphan to world famous dancer.<br/>In a Sierra Leone dust storm, ballet swooped into Michaela Mabinty DePrince’s life and never let her go. After her adoption brought her to the United States, ballet continued to be the consoling hand that guided Michaela, filling her with joy and hope. Over time, Michaela’s love for ballet only grew, and with it her dream of becoming a professional dancer.<br/>However, there were peers who told Michaela she didn’t belong in the ballet world, that her skin and vitiligo made her too different. But ballet had stirred in Michaela a faith and determination that would help her turn her dreams into a reality.<br/>From the acclaimed author of NAACP Image Award nominee Black Gold and What Love Looks Like, Laura Obuobi, and artist Olivia Duchess comes a lyrical and heartwarming picture book about one of the most influential ballerinas of our generation, inspiring all of us to never give up on our dreams.<br/>""This picture book offers a tale of inspiration, perseverance, and triumph for a dedicated Black ballerina.""—ALA Booklist",Hardcover,"Children's Books, Arts, Music & Photography, Performing Arts, Growing Up & Facts of Life, Family Life, Difficult Discussions, Friendship, Social Skills & School Life, Biographies, Multicultural, Women, Geography & Cultures, Explore the World, Multicultural Stories"
9780688149895,12,2,Love Poems,Nikki Giovanni,William Morrow,Non-Fiction,"In a career that has spanned more than a quarter century, Nikki Giovanni has earned the reputation as one of America's most celebrated and contoversial writers.Now, she presents a stunning collection of love poems that includes more than twenty new works.<br/>From the revolutionary ""Seduction"" to the tender new poem, ""Just a Simple Declaration of Love,"" from the whimsical ""I Wrote a Good Omelet"" to the elegiac ""All Eyez on U,"" written for Tupac Shakur, these poems embody the fearless passion and spirited wit for which Nikki Giovanni is beloved and revered.<br/>Romantic, bold, and erotic, Love Poems expresses notions of love in ways that are delightfully unexpected. Articulating in sensuous verse what we know only instinctively, Nikki Giovanni once again confirms her place as one of our nations's most distinguished poets and powerful truth-tellers. In a career that has spanned more than a quarter century, starting with her explosive early years in the Black Rights Movement, Nikki Giovanni has earned a reputation as one of America's most celebrated and controversial writers. Her mind-speaking work has made her a universal favorite and a number-one best-seller.The love poems-the revolutionary ""Seduction,"" the whimsical ""I Wrote a Good Omelet,"" and the tender ""My House"" to name just a few-are among the most beloved of all Nikki Giovanni's works. Now, Love Poems brings together these and other favorites with over twenty new poems. Romantic, bold, and erotic, Love Poems will once again confirm Nikki Giovanni's place among the country's most renowned poets and truth tellers.",Hardcover,"Literature & Fiction, Poetry, Regional & Cultural, Themes & Styles, Reference, Writing, Research & Publishing Guides, Writing, Self Service, Custom Stores"
9780744092196,8,4,Make Good Trouble: Discover Movements That Sparked Change,Jamia Wilson,DK Children,Children's,"Read real stories about moments that changed history and find out what you can do to make a difference!<br/><br/>""Our struggle is not the struggle of a day, a week, a month, or a year, it is the struggle of a lifetime. Never, ever be afraid to make some noise and get in good trouble, necessary trouble.""<br/>― John Lewis, Twitter 2018<br/>Inspired by civil rights activist and congressman John Lewis’s call to challenge injustice, explore famous moments of global activism throughout history with more than 70 narrative stories―including the Newsboys’ strike of 1899, the Freedom Summer Project of 1964, Greta Thunberg’s first School Strike for Climate, and students against book banning. Each true story shares how activists across a variety of beliefs, ages, and backgrounds called for change, empowering young readers of all ages, abilities, and circumstances to make a difference. Brimming with illustrations and additional resources, including a timeline and information about how kids can get involved, this is essential reading for budding activists.",Hardcover,"Children's Books, History, Geography & Cultures, Cultural Studies, Teen & Young Adult, Social Issues, Education & Reference, Social Science"
